{
  "contractVersion": "1.0.0",
  "messageId": "msg-0101",
  "occurredAt": "2026-10-05T13:05:00Z",
  "runId": "run-0001",
  "teamId": "team-0001",
  "matchId": "match-0001",
  "recordingSetVersionId": "rsv-0001",
  "workflow": { "id": "development-fixture", "version": "1.0.0" },
  "previousState": "Running",
  "state": "Cancelled",
  "correlation": { "correlationId": "corr-0001" }
}
