{
  "contractVersion": "1.0.0",
  "messageId": "msg-0100",
  "occurredAt": "2026-10-05T13:00:01Z",
  "runId": "run-0001",
  "teamId": "team-0001",
  "matchId": "match-0001",
  "recordingSetVersionId": "rsv-0001",
  "workflow": { "id": "development-fixture", "version": "1.0.0" },
  "previousState": "Requested",
  "state": "Running",
  "correlation": { "correlationId": "corr-0001" }
}
